{
  "schema_version":"0.1.0","project_id":"meydenbauer-b","name":"101 Meydenbauer, Building B","metadata":{"scope":"under-slab waste re-pipe","adapter_status":"bootstrap"},
  "evidence":[{"id":"meydenbauer-b:evidence:p1-02","kind":"drawing","source":"Exhibit A / P1.02","locator":"under-slab waste plan","description":"New waste routes and sizes; routes diagrammatic and stacks field verified.","checksum":null},{"id":"meydenbauer-b:evidence:p5-1-detail-10","kind":"drawing_detail","source":"P5.1","locator":"Detail 10","description":"Typical 2'-0\" trench width.","checksum":null},{"id":"meydenbauer-b:evidence:sor","kind":"scope","source":"Statement of Requirements","locator":"Initial Investigation / General Notes","description":"Recorded depth range includes 2.5–4.5 ft; high water table noted.","checksum":null},{"id":"meydenbauer-b:evidence:allowance-7","kind":"bid_form","source":"Bid Form / Addendum 1","locator":"Allowance No. 7","description":"700 SF slab allowance.","checksum":null}],
  "claims":[{"id":"meydenbauer-b:claim:underslab-route-source","subject_id":"meydenbauer-b:system:underslab-waste","predicate":"route_basis","value":"scaled/extracted from P1.02","evidence_ids":["meydenbauer-b:evidence:p1-02"],"status":"provisional","confidence":"medium","rationale":"Drawing routes were extracted and visually reviewed; field conditions remain unverified."},{"id":"meydenbauer-b:claim:poc-invert-depth","subject_id":"meydenbauer-b:system:underslab-waste","predicate":"poc_invert_depth_ft","value":null,"evidence_ids":["meydenbauer-b:evidence:p1-02","meydenbauer-b:evidence:sor"],"status":"unknown","confidence":"none","rationale":"P1.02 says MATCH EX. I.E.; no POC invert elevations are documented."},{"id":"meydenbauer-b:claim:typical-trench-width","subject_id":"meydenbauer-b:system:underslab-waste","predicate":"typical_trench_width_ft","value":2.0,"evidence_ids":["meydenbauer-b:evidence:p5-1-detail-10"],"status":"confirmed","confidence":"high","rationale":null},{"id":"meydenbauer-b:claim:slab-allowance","subject_id":"meydenbauer-b:system:underslab-waste","predicate":"slab_allowance_sf","value":700,"evidence_ids":["meydenbauer-b:evidence:allowance-7"],"status":"confirmed","confidence":"high","rationale":null}],
  "elements":[{"id":"meydenbauer-b:system:underslab-waste","kind":"system","name":"Building B under-slab waste re-pipe","project_id":"meydenbauer-b","parent_id":null,"source_ids":["meydenbauer-b:evidence:p1-02"],"status":"provisional","properties":{},"geometry_ref":"deliverables/underslab/Meydenbauer-B-underslab.glb"}],"relationships":[],
  "quantities":[{"id":"meydenbauer-b:quantity:pipe-length","element_id":"meydenbauer-b:system:underslab-waste","measure":"new_abs_length","value":312.75,"unit":"LF","scenario_id":null,"source_claim_ids":["meydenbauer-b:claim:underslab-route-source"]},{"id":"meydenbauer-b:quantity:s1:slab-cut","element_id":"meydenbauer-b:system:underslab-waste","measure":"slab_cut","value":590.0,"unit":"SF","scenario_id":"meydenbauer-b:scenario:s1","source_claim_ids":["meydenbauer-b:claim:typical-trench-width","meydenbauer-b:claim:poc-invert-depth"]},{"id":"meydenbauer-b:quantity:s1:excavation","element_id":"meydenbauer-b:system:underslab-waste","measure":"excavation_bank","value":72.0,"unit":"CY","scenario_id":"meydenbauer-b:scenario:s1","source_claim_ids":["meydenbauer-b:claim:poc-invert-depth"]},{"id":"meydenbauer-b:quantity:s2:slab-cut","element_id":"meydenbauer-b:system:underslab-waste","measure":"slab_cut","value":686.0,"unit":"SF","scenario_id":"meydenbauer-b:scenario:s2","source_claim_ids":["meydenbauer-b:claim:typical-trench-width","meydenbauer-b:claim:poc-invert-depth"]},{"id":"meydenbauer-b:quantity:s2:excavation","element_id":"meydenbauer-b:system:underslab-waste","measure":"excavation_bank","value":82.3,"unit":"CY","scenario_id":"meydenbauer-b:scenario:s2","source_claim_ids":["meydenbauer-b:claim:poc-invert-depth"]},{"id":"meydenbauer-b:quantity:s3:slab-cut","element_id":"meydenbauer-b:system:underslab-waste","measure":"slab_cut","value":991.0,"unit":"SF","scenario_id":"meydenbauer-b:scenario:s3","source_claim_ids":["meydenbauer-b:claim:typical-trench-width","meydenbauer-b:claim:poc-invert-depth"]},{"id":"meydenbauer-b:quantity:s3:excavation","element_id":"meydenbauer-b:system:underslab-waste","measure":"excavation_bank","value":158.0,"unit":"CY","scenario_id":"meydenbauer-b:scenario:s3","source_claim_ids":["meydenbauer-b:claim:poc-invert-depth"]}],
  "activities":[],"issues":[{"id":"meydenbauer-b:issue:poc-depth","title":"POC inverts undocumented","description":"Depth controls trench protection, slab disturbance, excavation and logistics.","severity":"critical","element_ids":["meydenbauer-b:system:underslab-waste"],"claim_ids":["meydenbauer-b:claim:poc-invert-depth"],"resolution_status":"open"},{"id":"meydenbauer-b:issue:groundwater","title":"Groundwater basis unresolved","description":"SOR notes a high water table; bid documents do not establish a dewatering allowance or unit price.","severity":"high","element_ids":["meydenbauer-b:system:underslab-waste"],"claim_ids":[],"resolution_status":"open"}],
  "scenarios":[{"id":"meydenbauer-b:scenario:s1","name":"S1","description":"2 ft trench only","inputs":{"trench_width_ft":2.0},"derived_from":null},{"id":"meydenbauer-b:scenario:s2","name":"S2","description":"S1 plus 3x3 pits at 30 fixture/stack connections","inputs":{"trench_width_ft":2.0,"connection_pit_ft":[3,3],"poc_invert_ft":3.5},"derived_from":null},{"id":"meydenbauer-b:scenario:s3","name":"S3","description":"4 ft cut wherever trench reaches 4 ft deep","inputs":{"deep_cut_width_ft":4.0,"poc_invert_ft":4.5},"derived_from":null}]
}
